Standard,Category,Call name,Inputs,Outputs,Description
WebGL2RenderingContext,Transform feedback,resumeTransformFeedback(),,,Resumes a transform feedback operation.
WebGL2RenderingContext,Uniform buffer objects,bindBufferBase(),"(Glenum, Gluint, WebGLBuffer)",,Binds a given WebGLBuffer to a given binding point (target) at a given index.
WebGL2RenderingContext,Uniform buffer objects,bindBufferRange(),"(Glenum, Gluint, WebGLBuffer, Glintptr, Glsizeitptr)",,Binds a range of a given WebGLBuffer to a given binding point (target) at a given index.
WebGL2RenderingContext,Uniform buffer objects,getUniformIndices(),"(WebGLProgram, Array)",Gluint*,Retrieves the indices of a number of uniforms within a WebGLProgram.
WebGL2RenderingContext,Uniform buffer objects,getActiveUniforms(),"(WebGLProgram, Gluint*, Glenum)",,Retrieves information about active uniforms within a WebGLProgram.
WebGL2RenderingContext,Uniform buffer objects,getUniformBlockIndex(),"(WebGLProgram, String)",Gluint,Retrieves the index of a uniform block within a WebGLProgram.
WebGL2RenderingContext,Uniform buffer objects,getActiveUniformBlockParameter(),"(WebGLProgram, Gluint, Glenum)",(depends on parameter),Retrieves information about an active uniform block within a WebGLProgram.
WebGL2RenderingContext,Uniform buffer objects,getActiveUniformBlockName(),"(WebGLProgram, Gluint)",String,Retrieves the name of the active uniform block at a given index within a WebGLProgram.
WebGL2RenderingContext,Uniform buffer objects,uniformBlockBinding(),"(WebGLProgram, Gluint, Gluint)",,Assigns binding points for active uniform blocks.
WebGL2RenderingContext,Vertex array objects,createVertexArray(),,WebGLVertexArrayObject,Creates a new WebGLVertexArrayObject.
WebGL2RenderingContext,Vertex array objects,deleteVertexArray(),(WebGLVertexArrayObject),,Deletes a given WebGLVertexArrayObject.
WebGL2RenderingContext,Vertex array objects,isVertexArray(),(WebGLVertexArrayObject),GLboolean,Returns true if a given object is a valid WebGLVertexArrayObject.
WebGL2RenderingContext,Vertex array objects,bindVertexArray(),(WebGLVertexArrayObject),,Binds a given WebGLVertexArrayObject to the buffer.
